{
  "version": "1.0.0",
  "generated_utc": "2025-08-13T09:00:17.015Z",
  "params_version": null,
  "metrics": {
    "total_snapshots": 40,
    "transitions": 10,
    "enters": 3,
    "reenters": 2,
    "exits": 5,
    "final_state": "CLEARED",
    "state_durations": {
      "NONE": 8,
      "CANDIDATE": 6,
      "ACTIVE": 14,
      "CLEARED": 12
    },
    "state_distribution": {
      "NONE": 0.2,
      "CANDIDATE": 0.15,
      "ACTIVE": 0.35,
      "CLEARED": 0.3
    }
  },
  "sequence": [
    0.53,
    0.69,
    0.56,
    0.63,
    0.53,
    0.59,
    0.51,
    0.69,
    0.73,
    0.73,
    0.64,
    0.72,
    0.57,
    0.58,
    0.46,
    0.47,
    0.62,
    0.6,
    0.65,
    0.48,
    0.56,
    0.73,
    0.64,
    0.51,
    0.68,
    0.74,
    0.69,
    0.62,
    0.6,
    0.66,
    0.51,
    0.59,
    0.65,
    0.75,
    0.73,
    0.46,
    0.49,
    0.53,
    0.51,
    0.69
  ]
}